DOI,标题,发表时间,原文链接,来源,通讯作者,单位地址,联系电话,电子邮箱,其他作者信息,线索等级
10.1021/acs.jmedchem.5c03498,Near-Infrared II Photoactivatable Prodrug Enables Tumor-Specific Stimulator of Interferon Genes Activation for Synergistic Photodynamic Immunotherapy,2026-03-12,https://doi.org/10.1021/acs.jmedchem.5c03498,PubMed,Hongmei Xia,"Department of Pharmacy, Anhui University of Chinese Medicine, Hefei 230012, China",,sm_shine@163.com,,C
10.3389/fonc.2026.1728876,Explore the efficacy of microwave ablation combined with fruquintinib and tislelizumab in the treatment of metastatic colorectal cancer,2026-02-24,https://doi.org/10.3389/fonc.2026.1728876,PubMed,Jincheng Meng,,,mengjincheng@zsszyy.net,,D
10.1097/CM9.0000000000004035,Therapy-induced remodeling of the tumor immune microenvironment: Mechanisms and therapeutic implications,2026-03-13,https://doi.org/10.1097/CM9.0000000000004035,PubMed,,,,,,D
10.1021/jacsau.5c01509,Dexter Energy Transfer Photocatalytic Microdissection of Amyloid Plaques in Alzheimer's Disease,2026-01-16,https://doi.org/10.1021/jacsau.5c01509,PubMed,Yu Liu,"State Key Laboratory of Medical Proteomics, National Chromatographic R. & A. Center, Dalian Institute of Chemical Physics, Chinese Academy of Sciences, 457 Zhongshan Road, Dalian 116023, China",,liuyu@dicp.ac.cn,,C
10.3389/fcimb.2026.1747682,Alveolar echinococcosis drives functional reprogramming of hepatic CD8+ T cells,2026-02-19,https://doi.org/10.3389/fcimb.2026.1747682,PubMed,Tao Li,"Department of Hepatobiliary Surgery, General Hospital of Ningxia Medical University, Yinchuan, China",,zyyp04435@nxmu.edu.cn,,C
